{"deployTreeSha256":"2abaf35a07f2a04593781b710768414ed890b90ebb16223b2b055b38c6ee4f6f","evidence":{"commit":"a1bfa394015ab199676b497d9f878bd1a021d772","markerSha256":"70d8f6505647ad832b038bafd543e4b56b82e6a12aac1f37051825dab80434c3","observedAt":"2026-10-12T11:44:17.402Z","outcome":"RECONCILED","pagesDeploymentId":"a1bfa394015ab199676b497d9f878bd1a021d772","workflowRunAttempt":1,"workflowRunId":"38244500223"},"releaseId":"8f43ad94-2eb4-46ec-8095-60324428a98a","releaseRecordSha256":"deeff957e4af337a83c2a39307b9d9c413825f6f4bd2d85ed93c57a4da108ac1","schemaVersion":1,"status":"RECONCILED"}
