{"deployTreeSha256":"3ab57862c2302cf234d4f9cdd4c5e792c573f29d34a7961e483c1d6965c11e88","evidence":{"commit":"ffd91bb99aff6c47644cb68a31ec695e42282cad","markerSha256":"44cf4495b7f2478df0fbca191fa042af4ab621fdb6815360549a4db4cde158d2","observedAt":"2026-10-12T12:29:42.016Z","outcome":"RECONCILED","pagesDeploymentId":"ffd91bb99aff6c47644cb68a31ec695e42282cad","workflowRunAttempt":1,"workflowRunId":"38249288183"},"releaseId":"1edb708c-9d96-4b20-b015-cd5cc429b6ed","releaseRecordSha256":"6b16586b45d50d5b6ce4c7bbff7757c1fe0396cfa4dee902218e304747e35ec1","schemaVersion":1,"status":"RECONCILED"}
