{"deployTreeSha256":"0989065311ae31589ec7bcd1667023c3e70f4a3edbbd20f1fab640ad93513428","evidence":{"commit":"5cd39aac3114daedfabe4b9fde979223ee5a7f4d","markerSha256":"5e4ef60fa1504a3b4d4114b46540c52575bf07fd2dd074b0e583b1a1ef8a850d","observedAt":"2026-10-13T10:51:45.458Z","outcome":"RECONCILED","pagesDeploymentId":"5cd39aac3114daedfabe4b9fde979223ee5a7f4d","workflowRunAttempt":1,"workflowRunId":"38386147610"},"releaseId":"9a01edc4-b19e-46ad-8185-a4effc00f84e","releaseRecordSha256":"e55b628de4d322bece6ae05e49ba78325602f3643cf648af33e6b020aef85d04","schemaVersion":1,"status":"RECONCILED"}
