{"deployTreeSha256":"9eaf9b6f63480ea912cdf41b0013402e9224ab57ea42f4aff96538f09aa602a6","evidence":{"commit":"d1e5a373b3345949920aed543e758a7f68b45d35","markerSha256":"9d329101c48f4235c2beba8d6e1fdf0d711366b8dddaba46220a3470b7024786","observedAt":"2026-10-12T09:13:40.127Z","outcome":"RECONCILED","pagesDeploymentId":"d1e5a373b3345949920aed543e758a7f68b45d35","workflowRunAttempt":1,"workflowRunId":"38228092127"},"releaseId":"66aec953-3ed0-4045-94c3-5e0da296a71c","releaseRecordSha256":"7a1b535b086aef9f68efe5cab8df4190d90f5d7e8dfd0ae2082c6838707a870e","schemaVersion":1,"status":"RECONCILED"}
