{"deployTreeSha256":"19e8cd1ee55b42325816c132909d1af6e75c00a297101cd6abaf42b848ea917a","evidence":{"commit":"b908f59f8c4afe8ed586e204c516912a1cd0e768","markerSha256":null,"observedAt":"2026-10-12T08:34:12.979Z","outcome":"NOT_DEPLOYED","pagesDeploymentId":null,"workflowRunAttempt":1,"workflowRunId":"38224349735"},"releaseId":"9db24796-7548-454a-b0d5-57444571ad60","releaseRecordSha256":"d8a1b99309011867c31a8173900469bdd280c4baff33e688feb6e76cebbcc1eb","schemaVersion":1,"status":"FAILED"}
